{
  "name": "rest-sample",
  "version": "v1",
  "driver": {
    "kind": "rest",
    "rest": {
      "url": "https://api.example.com/events",
      "method": "GET",
      "headers": {
        "Accept": "application/json"
      },
      "auth": {
        "kind": "api_key",
        "api_key": {
          "in": "header",
          "name": "X-API-KEY",
          "value": "<token>"
        }
      },
      "timeout_ms": 5000,
      "response_format": "json",
      "items_pointer": "/items"
    }
  },
  "payload_format": "json"
}
