{
  "name": "ops-db",
  "version": "v1",
  "driver": {
    "kind": "db",
    "db": {
      "kind": "mysql",
      "connection": "mysql://app:secret@127.0.0.1:53306/ops",
      "query": "SELECT defect_id, lot_id, notes FROM defect_events ORDER BY defect_id"
    }
  },
  "payload_format": "json",
  "record_id_policy": "strict",
  "record_id_paths": ["/defect_id", "/lot_id"],
  "required_paths": ["/defect_id", "/lot_id"]
}
